hospital,hospital_size,county,drg_code,name,price
EVERETT MED CTR,Large,Snohomish,856,Postoperative Or Post-Traumatic Infections With O.R. Procedures With Mcc,126225.4562
EVERETT MED CTR,Large,Snohomish,857,Postoperative Or Post-Traumatic Infections With O.R. Procedures With Cc,66097.2733
EVERETT MED CTR,Large,Snohomish,858,Postoperative Or Post-Traumatic Infections With O.R. Procedures Without Cc/Mcc,76042.79
EVERETT MED CTR,Large,Snohomish,862,Postoperative And Post-Traumatic Infections With Mcc,56113.1933
EVERETT MED CTR,Large,Snohomish,863,Postoperative And Post-Traumatic Infections Without Mcc,28846.2045
EVERETT MED CTR,Large,Snohomish,864,Fever And Inflammatory Conditions,23969.6423
EVERETT MED CTR,Large,Snohomish,865,Viral Illness With Mcc,110177.5243
EVERETT MED CTR,Large,Snohomish,866,Viral Illness Without Mcc,47466.3963
EVERETT MED CTR,Large,Snohomish,867,Other Infectious And Parasitic Diseases Diagnoses With Mcc,37270.9975
EVERETT MED CTR,Large,Snohomish,868,Other Infectious And Parasitic Diseases Diagnoses With Cc,63515.92
EVERETT MED CTR,Large,Snohomish,869,Other Infectious And Parasitic Diseases Diagnoses Without Cc/Mcc,22696.17
EVERETT MED CTR,Large,Snohomish,870,Septicemia Or Severe Sepsis With Mv >96 Hours,220817.4964
EVERETT MED CTR,Large,Snohomish,871,Septicemia Or Severe Sepsis Without Mv >96 Hours With Mcc,58257.5808
EVERETT MED CTR,Large,Snohomish,872,Septicemia Or Severe Sepsis Without Mv >96 Hours Without Mcc,32433.1436
EVERETT MED CTR,Large,Snohomish,876,O.R. Procedures With Principal Diagnosis Of Mental Illness,374433.4833
EVERETT MED CTR,Large,Snohomish,880,Acute Adjustment Reaction And Psychosocial Dysfunction,39671.1078
EVERETT MED CTR,Large,Snohomish,881,Depressive Neuroses,48754.3361
EVERETT MED CTR,Large,Snohomish,882,Neuroses Except Depressive,33472.69
EVERETT MED CTR,Large,Snohomish,883,Disorders Of Personality And Impulse Control,56203.23
EVERETT MED CTR,Large,Snohomish,884,Organic Disturbances And Intellectual Disability,144000.4379
EVERETT MED CTR,Large,Snohomish,885,Psychoses,38118.6426
EVERETT MED CTR,Large,Snohomish,886,Behavioral And Developmental Disorders,39302.5165
EVERETT MED CTR,Large,Snohomish,887,Other Mental Disorder Diagnoses,25536.48
EVERETT MED CTR,Large,Snohomish,894,"Alcohol, Drug Abuse Or Dependence, Left Ama",19298.4505
EVERETT MED CTR,Large,Snohomish,896,"Alcohol, Drug Abuse Or Dependence Without Rehabilitation Therapy With Mcc",65201.5029
EVERETT MED CTR,Large,Snohomish,897,"Alcohol, Drug Abuse Or Dependence Without Rehabilitation Therapy Without Mcc",16575.613
EVERETT MED CTR,Large,Snohomish,901,Wound Debridements For Injuries With Mcc,172786.1267
EVERETT MED CTR,Large,Snohomish,902,Wound Debridements For Injuries With Cc,115227.7933
EVERETT MED CTR,Large,Snohomish,906,Hand Procedures For Injuries,39395.9483
EVERETT MED CTR,Large,Snohomish,907,Other O.R. Procedures For Injuries With Mcc,172877.9075
EVERETT MED CTR,Large,Snohomish,908,Other O.R. Procedures For Injuries With Cc,69113.0273
EVERETT MED CTR,Large,Snohomish,909,Other O.R. Procedures For Injuries Without Cc/Mcc,57639.2321
EVERETT MED CTR,Large,Snohomish,913,Traumatic Injury With Mcc,98031.7
EVERETT MED CTR,Large,Snohomish,914,Traumatic Injury Without Mcc,29832.4943
EVERETT MED CTR,Large,Snohomish,915,Allergic Reactions With Mcc,38095.4067
EVERETT MED CTR,Large,Snohomish,916,Allergic Reactions Without Mcc,26379.2846
EVERETT MED CTR,Large,Snohomish,917,Poisoning And Toxic Effects Of Drugs With Mcc,49119.8883
EVERETT MED CTR,Large,Snohomish,918,Poisoning And Toxic Effects Of Drugs Without Mcc,21579.7441
EVERETT MED CTR,Large,Snohomish,919,Complications Of Treatment With Mcc,55913.3841
EVERETT MED CTR,Large,Snohomish,920,Complications Of Treatment With Cc,27613.9204
EVERETT MED CTR,Large,Snohomish,921,Complications Of Treatment Without Cc/Mcc,19423.97
EVERETT MED CTR,Large,Snohomish,922,"Other Injury, Poisoning And Toxic Effect Diagnoses With Mcc",75107.3375
EVERETT MED CTR,Large,Snohomish,923,"Other Injury, Poisoning And Toxic Effect Diagnoses Without Mcc",19636.88
EVERETT MED CTR,Large,Snohomish,928,Full Thickness Burn With Skin Graft Or Inhalation Injury With Cc/Mcc,194833.93
EVERETT MED CTR,Large,Snohomish,934,Full Thickness Burn Without Skin Graft Or Inhalation Injury,48325.67
EVERETT MED CTR,Large,Snohomish,935,Non-Extensive Burns,20695.68
EVERETT MED CTR,Large,Snohomish,939,O.R. Procedures With Diagnoses Of Other Contact With Health Services With Mcc,363651.84
EVERETT MED CTR,Large,Snohomish,940,O.R. Procedures With Diagnoses Of Other Contact With Health Services With Cc,56999.66
EVERETT MED CTR,Large,Snohomish,941,O.R. Procedures With Diagnoses Of Other Contact With Health Services Without Cc/Mcc,57547.32
EVERETT MED CTR,Large,Snohomish,947,Signs And Symptoms With Mcc,48847.964
EVERETT MED CTR,Large,Snohomish,948,Signs And Symptoms Without Mcc,28115.6698
EVERETT MED CTR,Large,Snohomish,949,Aftercare With Cc/Mcc,46681.2558
EVERETT MED CTR,Large,Snohomish,950,Aftercare Without Cc/Mcc,36786.95
EVERETT MED CTR,Large,Snohomish,951,Other Factors Influencing Health Status,20616.995
EVERETT MED CTR,Large,Snohomish,955,Craniotomy For Multiple Significant Trauma,264695.2225
EVERETT MED CTR,Large,Snohomish,956,"Limb Reattachment, Hip And Femur Procedures For Multiple Significant Trauma",148629.0
EVERETT MED CTR,Large,Snohomish,957,Other O.R. Procedures For Multiple Significant Trauma With Mcc,225344.7456
EVERETT MED CTR,Large,Snohomish,958,Other O.R. Procedures For Multiple Significant Trauma With Cc,111657.8563
EVERETT MED CTR,Large,Snohomish,963,Other Multiple Significant Trauma With Mcc,76483.8564
EVERETT MED CTR,Large,Snohomish,964,Other Multiple Significant Trauma With Cc,48378.8654
EVERETT MED CTR,Large,Snohomish,965,Other Multiple Significant Trauma Without Cc/Mcc,32042.24
EVERETT MED CTR,Large,Snohomish,969,Hiv With Extensive O.R. Procedures With Mcc,352925.45
EVERETT MED CTR,Large,Snohomish,974,Hiv With Major Related Condition With Mcc,45780.108
EVERETT MED CTR,Large,Snohomish,975,Hiv With Major Related Condition With Cc,26440.25
EVERETT MED CTR,Large,Snohomish,981,Extensive O.R. Procedures Unrelated To Principal Diagnosis With Mcc,126043.5708
EVERETT MED CTR,Large,Snohomish,982,Extensive O.R. Procedures Unrelated To Principal Diagnosis With Cc,93118.7063
EVERETT MED CTR,Large,Snohomish,983,Extensive O.R. Procedures Unrelated To Principal Diagnosis Without Cc/Mcc,33786.0925
EVERETT MED CTR,Large,Snohomish,987,Non-Extensive O.R. Procedures Unrelated To Principal Diagnosis With Mcc,154838.0211
EVERETT MED CTR,Large,Snohomish,988,Non-Extensive O.R. Procedures Unrelated To Principal Diagnosis With Cc,68374.6792
EVERETT MED CTR,Large,Snohomish,989,Non-Extensive O.R. Procedures Unrelated To Principal Diagnosis Without Cc/Mcc,29559.0986
EVERETT MED CTR,Large,Snohomish,998,Principal Diagnosis Invalid As Discharge Diagnosis,13365.695
HOLY FAMILY,Large,Spokane,4,"Tracheostomy With Mv >96 Hours Or Principal Diagnosis Except Face, Mouth And Neck Without Major O.R.",389283.3692
HOLY FAMILY,Large,Spokane,41,"Peripheral, Cranial Nerve And Other Nervous System Procedures With Cc Or Peripheral Neurostimulator",79887.4004
HOLY FAMILY,Large,Spokane,42,"Peripheral, Cranial Nerve And Other Nervous System Procedures Without Cc/Mcc",34923.5016
HOLY FAMILY,Large,Spokane,54,Nervous System Neoplasms With Mcc,40732.0323
HOLY FAMILY,Large,Spokane,56,Degenerative Nervous System Disorders With Mcc,85902.8934
HOLY FAMILY,Large,Spokane,57,Degenerative Nervous System Disorders Without Mcc,78408.5482
HOLY FAMILY,Large,Spokane,58,Multiple Sclerosis And Cerebellar Ataxia With Mcc,50663.6702
HOLY FAMILY,Large,Spokane,59,Multiple Sclerosis And Cerebellar Ataxia With Cc,34375.0554
HOLY FAMILY,Large,Spokane,60,Multiple Sclerosis And Cerebellar Ataxia Without Cc/Mcc,37775.2012
HOLY FAMILY,Large,Spokane,61,"Ischemic Stroke, Precerebral Occlusion Or Transient Ischemia With Thrombolytic Agent With Mcc",51841.3016
HOLY FAMILY,Large,Spokane,62,"Ischemic Stroke, Precerebral Occlusion Or Transient Ischemia With Thrombolytic Agent With Cc",55443.9012
HOLY FAMILY,Large,Spokane,63,"Ischemic Stroke, Precerebral Occlusion Or Transient Ischemia With Thrombolytic Agent Without Cc/Mcc",56104.7826
HOLY FAMILY,Large,Spokane,64,Intracranial Hemorrhage Or Cerebral Infarction With Mcc,44960.0554
HOLY FAMILY,Large,Spokane,65,Intracranial Hemorrhage Or Cerebral Infarction With Cc Or Tpa In 24 Hours,30126.5334
HOLY FAMILY,Large,Spokane,66,Intracranial Hemorrhage Or Cerebral Infarction Without Cc/Mcc,28956.7725
HOLY FAMILY,Large,Spokane,68,Nonspecific Cva And Precerebral Occlusion Without Infarction Without Mcc,24637.8467
HOLY FAMILY,Large,Spokane,69,Transient Ischemia Without Thrombolytic,38539.9509
HOLY FAMILY,Large,Spokane,70,Nonspecific Cerebrovascular Disorders With Mcc,53263.5609
HOLY FAMILY,Large,Spokane,71,Nonspecific Cerebrovascular Disorders With Cc,32809.0687
HOLY FAMILY,Large,Spokane,72,Nonspecific Cerebrovascular Disorders Without Cc/Mcc,28969.8313
HOLY FAMILY,Large,Spokane,73,Cranial And Peripheral Nerve Disorders With Mcc,37539.591
HOLY FAMILY,Large,Spokane,74,Cranial And Peripheral Nerve Disorders Without Mcc,20560.1542
HOLY FAMILY,Large,Spokane,75,Viral Meningitis With Cc/Mcc,32920.6923
HOLY FAMILY,Large,Spokane,80,Nontraumatic Stupor And Coma With Mcc,162761.0985
HOLY FAMILY,Large,Spokane,82,Traumatic Stupor And Coma >1 Hour With Mcc,31267.2671
HOLY FAMILY,Large,Spokane,83,Traumatic Stupor And Coma >1 Hour With Cc,22763.4802
HOLY FAMILY,Large,Spokane,85,Traumatic Stupor And Coma <1 Hour With Mcc,140162.8558
HOLY FAMILY,Large,Spokane,86,Traumatic Stupor And Coma <1 Hour With Cc,34431.1902
HOLY FAMILY,Large,Spokane,87,Traumatic Stupor And Coma <1 Hour Without Cc/Mcc,35354.0666
HOLY FAMILY,Large,Spokane,91,Other Disorders Of Nervous System With Mcc,56122.4228
HOLY FAMILY,Large,Spokane,92,Other Disorders Of Nervous System With Cc,25166.93
HOLY FAMILY,Large,Spokane,93,Other Disorders Of Nervous System Without Cc/Mcc,18081.5717
HOLY FAMILY,Large,Spokane,94,Bacterial And Tuberculous Infections Of Nervous System With Mcc,86549.2027
HOLY FAMILY,Large,Spokane,95,Bacterial And Tuberculous Infections Of Nervous System With Cc,74747.4355
HOLY FAMILY,Large,Spokane,97,Non-Bacterial Infection Of Nervous System Except Viral Meningitis With Mcc,49210.2547
HOLY FAMILY,Large,Spokane,98,Non-Bacterial Infection Of Nervous System Except Viral Meningitis With Cc,81382.1938
HOLY FAMILY,Large,Spokane,100,Seizures With Mcc,56221.6931
HOLY FAMILY,Large,Spokane,101,Seizures Without Mcc,31663.2824
HOLY FAMILY,Large,Spokane,103,Headaches Without Mcc,31157.6765
HOLY FAMILY,Large,Spokane,117,Intraocular Procedures Without Cc/Mcc,27945.8483
HOLY FAMILY,Large,Spokane,121,Acute Major Eye Infections With Cc/Mcc,34691.3829
HOLY FAMILY,Large,Spokane,123,Neurological Eye Disorders,35259.4028
HOLY FAMILY,Large,Spokane,124,Other Disorders Of The Eye With Mcc,57893.5058
HOLY FAMILY,Large,Spokane,133,"Other Ear, Nose, Mouth & Throat O.R. Procedures W Cc/Mcc",16873.0553
HOLY FAMILY,Large,Spokane,146,"Ear, Nose, Mouth And Throat Malignancy With Mcc",86826.4233
HOLY FAMILY,Large,Spokane,149,Dysequilibrium,22548.5984
HOLY FAMILY,Large,Spokane,150,Epistaxis With Mcc,33361.7095
HOLY FAMILY,Large,Spokane,152,Otitis Media And Uri With Mcc,24914.4974
HOLY FAMILY,Large,Spokane,153,Otitis Media And Uri Without Mcc,26396.2502
HOLY FAMILY,Large,Spokane,155,"Other Ear, Nose, Mouth And Throat Diagnoses With Cc",24831.8512
HOLY FAMILY,Large,Spokane,157,Dental And Oral Diseases With Mcc,31467.8016
HOLY FAMILY,Large,Spokane,158,Dental And Oral Diseases With Cc,41076.6703
HOLY FAMILY,Large,Spokane,159,Dental And Oral Diseases Without Cc/Mcc,23175.2796
HOLY FAMILY,Large,Spokane,163,Major Chest Procedures With Mcc,150239.1355
HOLY FAMILY,Large,Spokane,164,Major Chest Procedures With Cc,110276.1896
HOLY FAMILY,Large,Spokane,165,Major Chest Procedures Without Cc/Mcc,69187.5015
HOLY FAMILY,Large,Spokane,166,Other Respiratory System O.R. Procedures With Mcc,111894.1418
HOLY FAMILY,Large,Spokane,168,Other Respiratory System O.R. Procedures Without Cc/Mcc,28204.9423
HOLY FAMILY,Large,Spokane,175,Pulmonary Embolism With Mcc Or Acute Cor Pulmonale,41506.0354
HOLY FAMILY,Large,Spokane,176,Pulmonary Embolism Without Mcc,28206.5971
HOLY FAMILY,Large,Spokane,177,Respiratory Infections And Inflammations With Mcc,56772.2569
HOLY FAMILY,Large,Spokane,178,Respiratory Infections And Inflammations With Cc,39423.3628
HOLY FAMILY,Large,Spokane,179,Respiratory Infections And Inflammations Without Cc/Mcc,35959.8646
HOLY FAMILY,Large,Spokane,180,Respiratory Neoplasms With Mcc,66708.7478
HOLY FAMILY,Large,Spokane,181,Respiratory Neoplasms With Cc,24342.9756
HOLY FAMILY,Large,Spokane,183,Major Chest Trauma With Mcc,26666.8202
HOLY FAMILY,Large,Spokane,185,Major Chest Trauma Without Cc/Mcc,23832.4492
HOLY FAMILY,Large,Spokane,186,Pleural Effusion With Mcc,30882.8429
HOLY FAMILY,Large,Spokane,189,Pulmonary Edema And Respiratory Failure,42114.1067
HOLY FAMILY,Large,Spokane,190,Chronic Obstructive Pulmonary Disease With Mcc,38765.2195
HOLY FAMILY,Large,Spokane,191,Chronic Obstructive Pulmonary Disease With Cc,50051.2366
HOLY FAMILY,Large,Spokane,192,Chronic Obstructive Pulmonary Disease Without Cc/Mcc,21628.7122
HOLY FAMILY,Large,Spokane,193,Simple Pneumonia And Pleurisy With Mcc,39213.5188
HOLY FAMILY,Large,Spokane,194,Simple Pneumonia And Pleurisy With Cc,30420.0442
HOLY FAMILY,Large,Spokane,195,Simple Pneumonia And Pleurisy Without Cc/Mcc,20753.0685
HOLY FAMILY,Large,Spokane,196,Interstitial Lung Disease With Mcc,57460.0708
HOLY FAMILY,Large,Spokane,199,Pneumothorax With Mcc,29561.3964
HOLY FAMILY,Large,Spokane,200,Pneumothorax With Cc,21769.2185
HOLY FAMILY,Large,Spokane,201,Pneumothorax Without Cc/Mcc,40003.614
HOLY FAMILY,Large,Spokane,202,Bronchitis And Asthma With Cc/Mcc,32349.7439
HOLY FAMILY,Large,Spokane,203,Bronchitis And Asthma Without Cc/Mcc,30904.6465
HOLY FAMILY,Large,Spokane,205,Other Respiratory System Diagnoses With Mcc,38497.6125
HOLY FAMILY,Large,Spokane,206,Other Respiratory System Diagnoses Without Mcc,21829.4094
HOLY FAMILY,Large,Spokane,207,Respiratory System Diagnosis With Ventilator Support >96 Hours,192542.8783
HOLY FAMILY,Large,Spokane,208,Respiratory System Diagnosis With Ventilator Support <=96 Hours,89498.6249
HOLY FAMILY,Large,Spokane,239,Amputation For Circulatory System Disorders Except Upper Limb And Toe With Mcc,45406.4366
HOLY FAMILY,Large,Spokane,240,Amputation For Circulatory System Disorders Except Upper Limb And Toe With Cc,26320.2378
HOLY FAMILY,Large,Spokane,252,Other Vascular Procedures With Mcc,68768.0165
HOLY FAMILY,Large,Spokane,255,Upper Limb And Toe Amputation For Circulatory System Disorders With Mcc,82824.6423
HOLY FAMILY,Large,Spokane,256,Upper Limb And Toe Amputation For Circulatory System Disorders With Cc,31745.7423
HOLY FAMILY,Large,Spokane,264,Other Circulatory System O.R. Procedures,38289.3373
HOLY FAMILY,Large,Spokane,270,Other Major Cardiovascular Procedures With Mcc,104629.7392
HOLY FAMILY,Large,Spokane,271,Other Major Cardiovascular Procedures With Cc,94148.9248
HOLY FAMILY,Large,Spokane,272,Other Major Cardiovascular Procedures Without Cc/Mcc,75869.6036
HOLY FAMILY,Large,Spokane,280,"Acute Myocardial Infarction, Discharged Alive With Mcc",52905.5307
HOLY FAMILY,Large,Spokane,281,"Acute Myocardial Infarction, Discharged Alive With Cc",21826.9841
HOLY FAMILY,Large,Spokane,282,"Acute Myocardial Infarction, Discharged Alive Without Cc/Mcc",19201.3816
HOLY FAMILY,Large,Spokane,283,"Acute Myocardial Infarction, Expired With Mcc",39694.3332
HOLY FAMILY,Large,Spokane,286,"Circulatory Disorders Except Ami, With Cardiac Catheterization With Mcc",107608.2562
HOLY FAMILY,Large,Spokane,288,Acute And Subacute Endocarditis With Mcc,20891.0272
HOLY FAMILY,Large,Spokane,289,Acute And Subacute Endocarditis With Cc,20150.6026
HOLY FAMILY,Large,Spokane,291,Heart Failure And Shock With Mcc,36826.3165
HOLY FAMILY,Large,Spokane,292,Heart Failure And Shock With Cc,27567.3991
HOLY FAMILY,Large,Spokane,293,Heart Failure And Shock Without Cc/Mcc,17661.5639
HOLY FAMILY,Large,Spokane,296,"Cardiac Arrest, Unexplained With Mcc",40519.6539
HOLY FAMILY,Large,Spokane,299,Peripheral Vascular Disorders With Mcc,68649.3145
HOLY FAMILY,Large,Spokane,300,Peripheral Vascular Disorders With Cc,28361.8669
HOLY FAMILY,Large,Spokane,301,Peripheral Vascular Disorders Without Cc/Mcc,50285.9024
HOLY FAMILY,Large,Spokane,304,Hypertension With Mcc,37862.9647
HOLY FAMILY,Large,Spokane,305,Hypertension Without Mcc,24358.793
HOLY FAMILY,Large,Spokane,306,Cardiac Congenital And Valvular Disorders With Mcc,18795.2762
HOLY FAMILY,Large,Spokane,308,Cardiac Arrhythmia And Conduction Disorders With Mcc,42360.625
HOLY FAMILY,Large,Spokane,309,Cardiac Arrhythmia And Conduction Disorders With Cc,28312.5963
HOLY FAMILY,Large,Spokane,310,Cardiac Arrhythmia And Conduction Disorders Without Cc/Mcc,18879.3907
HOLY FAMILY,Large,Spokane,311,Angina Pectoris,16143.8828
HOLY FAMILY,Large,Spokane,312,Syncope And Collapse,29697.6812
HOLY FAMILY,Large,Spokane,313,Chest Pain,21014.0672
HOLY FAMILY,Large,Spokane,314,Other Circulatory System Diagnoses With Mcc,58148.046
HOLY FAMILY,Large,Spokane,315,Other Circulatory System Diagnoses With Cc,34239.6181
HOLY FAMILY,Large,Spokane,326,"Stomach, Esophageal And Duodenal Procedures With Mcc",116719.4474
HOLY FAMILY,Large,Spokane,327,"Stomach, Esophageal And Duodenal Procedures With Cc",70735.2574
HOLY FAMILY,Large,Spokane,328,"Stomach, Esophageal And Duodenal Procedures Without Cc/Mcc",48196.293
HOLY FAMILY,Large,Spokane,329,Major Small And Large Bowel Procedures With Mcc,123376.8033
HOLY FAMILY,Large,Spokane,330,Major Small And Large Bowel Procedures With Cc,72648.4716
HOLY FAMILY,Large,Spokane,331,Major Small And Large Bowel Procedures Without Cc/Mcc,65053.887
HOLY FAMILY,Large,Spokane,335,Peritoneal Adhesiolysis With Mcc,83234.0917
HOLY FAMILY,Large,Spokane,336,Peritoneal Adhesiolysis With Cc,61545.6148
HOLY FAMILY,Large,Spokane,337,Peritoneal Adhesiolysis Without Cc/Mcc,46645.8666
HOLY FAMILY,Large,Spokane,338,Appendectomy With Complicated Principal Diagnosis With Mcc,84505.428
HOLY FAMILY,Large,Spokane,339,Appendectomy With Complicated Principal Diagnosis With Cc,39459.5388
HOLY FAMILY,Large,Spokane,340,Appendectomy With Complicated Principal Diagnosis Without Cc/Mcc,37793.5671
HOLY FAMILY,Large,Spokane,342,Appendectomy Without Complicated Principal Diagnosis With Cc,40622.7867
HOLY FAMILY,Large,Spokane,343,Appendectomy Without Complicated Principal Diagnosis Without Cc/Mcc,28548.0242
HOLY FAMILY,Large,Spokane,344,Minor Small And Large Bowel Procedures With Mcc,46605.8871
HOLY FAMILY,Large,Spokane,345,Minor Small And Large Bowel Procedures With Cc,126393.3622
HOLY FAMILY,Large,Spokane,347,Anal And Stomal Procedures With Mcc,83751.3655
HOLY FAMILY,Large,Spokane,348,Anal And Stomal Procedures With Cc,54191.2912
HOLY FAMILY,Large,Spokane,350,Inguinal And Femoral Hernia Procedures With Mcc,118890.0108
HOLY FAMILY,Large,Spokane,351,Inguinal And Femoral Hernia Procedures With Cc,46282.2147
HOLY FAMILY,Large,Spokane,352,Inguinal And Femoral Hernia Procedures Without Cc/Mcc,23692.4992
HOLY FAMILY,Large,Spokane,353,Hernia Procedures Except Inguinal And Femoral With Mcc,115805.31
HOLY FAMILY,Large,Spokane,354,Hernia Procedures Except Inguinal And Femoral With Cc,74043.1315
HOLY FAMILY,Large,Spokane,355,Hernia Procedures Except Inguinal And Femoral Without Cc/Mcc,49150.9638
HOLY FAMILY,Large,Spokane,356,Other Digestive System O.R. Procedures With Mcc,156982.4226
HOLY FAMILY,Large,Spokane,357,Other Digestive System O.R. Procedures With Cc,105640.1399
HOLY FAMILY,Large,Spokane,358,Other Digestive System O.R. Procedures Without Cc/Mcc,30657.4455
HOLY FAMILY,Large,Spokane,368,Major Esophageal Disorders With Mcc,45992.1988
HOLY FAMILY,Large,Spokane,369,Major Esophageal Disorders With Cc,42383.7234
HOLY FAMILY,Large,Spokane,370,Major Esophageal Disorders Without Cc/Mcc,29940.0478
HOLY FAMILY,Large,Spokane,371,Major Gastrointestinal Disorders And Peritoneal Infections With Mcc,93141.5137
HOLY FAMILY,Large,Spokane,372,Major Gastrointestinal Disorders And Peritoneal Infections With Cc,23353.9755
HOLY FAMILY,Large,Spokane,373,Major Gastrointestinal Disorders And Peritoneal Infections Without Cc/Mcc,17917.3927
HOLY FAMILY,Large,Spokane,374,Digestive Malignancy With Mcc,32300.1376
HOLY FAMILY,Large,Spokane,375,Digestive Malignancy With Cc,29077.5074
HOLY FAMILY,Large,Spokane,376,Digestive Malignancy Without Cc/Mcc,34647.1885
HOLY FAMILY,Large,Spokane,377,Gastrointestinal Hemorrhage With Mcc,50855.8802
HOLY FAMILY,Large,Spokane,378,Gastrointestinal Hemorrhage With Cc,34504.7705
HOLY FAMILY,Large,Spokane,379,Gastrointestinal Hemorrhage Without Cc/Mcc,28501.6176
HOLY FAMILY,Large,Spokane,380,Complicated Peptic Ulcer With Mcc,36720.0414
HOLY FAMILY,Large,Spokane,381,Complicated Peptic Ulcer With Cc,24516.8599
HOLY FAMILY,Large,Spokane,382,Complicated Peptic Ulcer Without Cc/Mcc,53287.3424
HOLY FAMILY,Large,Spokane,383,Uncomplicated Peptic Ulcer With Mcc,49318.0813
HOLY FAMILY,Large,Spokane,385,Inflammatory Bowel Disease With Mcc,29325.1184
HOLY FAMILY,Large,Spokane,386,Inflammatory Bowel Disease With Cc,28346.7615
HOLY FAMILY,Large,Spokane,387,Inflammatory Bowel Disease Without Cc/Mcc,23860.1898
HOLY FAMILY,Large,Spokane,388,Gastrointestinal Obstruction With Mcc,35122.0968
HOLY FAMILY,Large,Spokane,389,Gastrointestinal Obstruction With Cc,21428.8735
HOLY FAMILY,Large,Spokane,390,Gastrointestinal Obstruction Without Cc/Mcc,14708.4373
HOLY FAMILY,Large,Spokane,391,"Esophagitis, Gastroenteritis And Miscellaneous Digestive Disorders With Mcc",37439.9211
HOLY FAMILY,Large,Spokane,392,"Esophagitis, Gastroenteritis And Miscellaneous Digestive Disorders Without Mcc",29718.4774
HOLY FAMILY,Large,Spokane,393,Other Digestive System Diagnoses With Mcc,47175.5874
HOLY FAMILY,Large,Spokane,394,Other Digestive System Diagnoses With Cc,22695.1131
HOLY FAMILY,Large,Spokane,395,Other Digestive System Diagnoses Without Cc/Mcc,15423.6979
HOLY FAMILY,Large,Spokane,405,"Pancreas, Liver And Shunt Procedures With Mcc",95625.4441
HOLY FAMILY,Large,Spokane,411,Cholecystectomy With C.D.E. With Mcc,73297.2225
HOLY FAMILY,Large,Spokane,414,Cholecystectomy Except By Laparoscope Without C.D.E. With Mcc,47120.8573
HOLY FAMILY,Large,Spokane,417,Laparoscopic Cholecystectomy Without C.D.E. With Mcc,68390.5565
HOLY FAMILY,Large,Spokane,418,Laparoscopic Cholecystectomy Without C.D.E. With Cc,49638.4655
HOLY FAMILY,Large,Spokane,419,Laparoscopic Cholecystectomy Without C.D.E. Without Cc/Mcc,47559.1051
HOLY FAMILY,Large,Spokane,432,Cirrhosis And Alcoholic Hepatitis With Mcc,66114.0152
HOLY FAMILY,Large,Spokane,433,Cirrhosis And Alcoholic Hepatitis With Cc,31895.3646
HOLY FAMILY,Large,Spokane,435,Malignancy Of Hepatobiliary System Or Pancreas With Mcc,18756.8805
HOLY FAMILY,Large,Spokane,436,Malignancy Of Hepatobiliary System Or Pancreas With Cc,24124.8522
HOLY FAMILY,Large,Spokane,438,Disorders Of Pancreas Except Malignancy With Mcc,56998.6655
HOLY FAMILY,Large,Spokane,439,Disorders Of Pancreas Except Malignancy With Cc,28727.4946
HOLY FAMILY,Large,Spokane,440,Disorders Of Pancreas Except Malignancy Without Cc/Mcc,21148.8372
HOLY FAMILY,Large,Spokane,441,"Disorders Of Liver Except Malignancy, Cirrhosis Or Alcoholic Hepatitis With Mcc",51874.2917
HOLY FAMILY,Large,Spokane,442,"Disorders Of Liver Except Malignancy, Cirrhosis Or Alcoholic Hepatitis With Cc",24791.0892
HOLY FAMILY,Large,Spokane,443,"Disorders Of Liver Except Malignancy, Cirrhosis Or Alcoholic Hepatitis Without Cc/Mcc",26890.616
HOLY FAMILY,Large,Spokane,444,Disorders Of The Biliary Tract With Mcc,50777.7222
HOLY FAMILY,Large,Spokane,445,Disorders Of The Biliary Tract With Cc,54236.4631
HOLY FAMILY,Large,Spokane,446,Disorders Of The Biliary Tract Without Cc/Mcc,32767.4407
HOLY FAMILY,Large,Spokane,455,Combined Anterior And Posterior Spinal Fusion Without Cc/Mcc,110635.0502
HOLY FAMILY,Large,Spokane,460,Spinal Fusion Except Cervical Without Mcc,110523.2664
HOLY FAMILY,Large,Spokane,462,Bilateral Or Multiple Major Joint Procedures Of Lower Extremity Without Mcc,89708.6689
HOLY FAMILY,Large,Spokane,463,Wound Debridement And Skin Graft Except Hand For Musculoskeletal And Connective Tissue Disorders Wit,120654.6358
HOLY FAMILY,Large,Spokane,464,Wound Debridement And Skin Graft Except Hand For Musculoskeletal And Connective Tissue Disorders Wit,86608.3926
HOLY FAMILY,Large,Spokane,465,Wound Debridement And Skin Graft Except Hand For Musculoskeletal And Connective Tissue Disorders Wit,95261.4656
HOLY FAMILY,Large,Spokane,466,Revision Of Hip Or Knee Replacement With Mcc,133477.4328
HOLY FAMILY,Large,Spokane,467,Revision Of Hip Or Knee Replacement With Cc,109441.2463
HOLY FAMILY,Large,Spokane,468,Revision Of Hip Or Knee Replacement Without Cc/Mcc,90790.5509
HOLY FAMILY,Large,Spokane,469,Major Hip And Knee Joint Replacement Or Reattachment Of Lower Extremity With Mcc Or Total Ankle Repl,90109.4561
HOLY FAMILY,Large,Spokane,470,Major Hip And Knee Joint Replacement Or Reattachment Of Lower Extremity Without Mcc,59906.915
HOLY FAMILY,Large,Spokane,473,Cervical Spinal Fusion Without Cc/Mcc,47698.3082
HOLY FAMILY,Large,Spokane,474,Amputation For Musculoskeletal System And Connective Tissue Disorders With Mcc,89492.3616
HOLY FAMILY,Large,Spokane,475,Amputation For Musculoskeletal System And Connective Tissue Disorders With Cc,43657.7763
HOLY FAMILY,Large,Spokane,476,Amputation For Musculoskeletal System And Connective Tissue Disorders Without Cc/Mcc,33227.3915
HOLY FAMILY,Large,Spokane,477,Biopsies Of Musculoskeletal System And Connective Tissue With Mcc,71055.9785
HOLY FAMILY,Large,Spokane,478,Biopsies Of Musculoskeletal System And Connective Tissue With Cc,125932.0682
HOLY FAMILY,Large,Spokane,480,Hip And Femur Procedures Except Major Joint With Mcc,82815.2946
HOLY FAMILY,Large,Spokane,481,Hip And Femur Procedures Except Major Joint With Cc,57967.987
